created_at,text,hashtags,user_mention_ids,user_mention_screen_names,retweet_count,favorite_count,in_reply_to_user_id,in_reply_to_screen_name,user_id,user_screen_name,user_name,user_friends_count,user_followers_count,user_favourites_count,user_verfied,user_statuses_count
2022-06-16 15:08:33,When your boss give you his comp code to get free Starbucks today &gt;&gt;&gt;&gt;,[],[],[],0,0,,,388056028,seymonecristina,🥀,672,1539,34308,False,89820
2022-06-16 15:08:13,Starbucks gives me hope sometimes ,[],[],[],0,2,,,1389977504451112960,maggiecube34,Ashley,706,2758,2998,False,6058
2022-06-16 15:08:12,"i like that starbucks normalized chocolate milk as a lil treat for adults by calling it foam and adding it to coffee, 5 stars",[],[],[],0,0,,,50136701,sssjjjjjh,✨,292,202,31488,False,10695
2022-06-16 15:08:07,you bold as hell if you wake up &amp; go get some Starbucks and dont have no damn job ,[],[],[],0,0,,,4878124055,EatEmUpLang,MajorLangston,318,303,1952,False,976
2022-06-16 15:07:59,"Like Starbucks yum yum u can made is it! ,",[],[1515238945415917568],['tastydelightsss'],0,0,1515238945415917568,tastydelightsss,1221456319963713536,TariqGhakhar1,Tariq Ghakhar,862,421,23659,False,29407
2022-06-16 15:07:58,"Is the son going to go live from a Starbucks drive through &amp; rant about this ,",[],[],[],0,0,,,2760893870,atikkat,protein shaker,458,682,56,False,71054
2022-06-16 15:07:46,I always choose the starbucks that doesnt have my sandwich ,[],[],[],0,0,,,1189594592250695680,Lisssvfer,アリサ,86,20,10153,False,2815
2022-06-16 15:07:36,reading a fanfic at a starbucks its the most y/n thing that ive done in a while lmao,[],[],[],0,1,,,997546516108673025,topolinorocks,topi,301,66,4280,False,519
2022-06-16 15:07:29,"Seeing this little fella outside of Starbucks made my entire morning.  ,",[],[],[],0,3,,,93693603,TVandCrumpets,Donnie | 🏳️‍🌈,361,291,33978,False,29620
2022-06-16 15:07:17,Im becoming a Starbucks hoe I fear,[],[],[],0,2,,,61658961,noimdeedee,Shea Butter Papi,715,1054,35632,False,67421
2022-06-16 15:07:14,Living across the street from a Starbucks is so dangerous.,[],[],[],0,1,,,1512544788,M_Peasey,Megs 🖤,482,746,26349,False,11687
2022-06-16 15:07:08,"During the height of Shanghais lockdown, around 900 Starbucks stores were temporarily closed. However, China's CEO, Leo Tsoi, said that this is only chapter one of Starbucks' journey in the Chinese coffee market. Find out more in our article: ,",[],[30973],['Starbucks'],0,0,,,1492176745675567114,coffee_intell,Coffee Intelligence,18,53,20,False,85
2022-06-16 15:07:04,"I always been a person trust me I don't like no Starbucks! ,",['Dunkin'],[],[],1,1,,,1444346634838679553,Telia_121814,Telia. 💜,179,330,3629,False,924
2022-06-16 15:06:53,Im finna cheat and get me some Starbucks ,[],[],[],0,0,,,3087677087,mzg0diva757,Desire’,574,503,864,False,3869
2022-06-16 15:06:51,livin off da adderall &amp; starbucks ,[],[],[],0,0,,,465160899,stephvroman,coquí.,131,429,31945,False,26518
2022-06-16 15:06:38,Find the nearest Starbucks and put your own decorated tip jar at the register.,[],[1027554193],['Anania00'],0,1,1027554193,Anania00,1495812009677529089,taeyongho3,!!!,11,4,1190,False,399
2022-06-16 15:06:28,"Don't submit then quit. Apply for jobs like ""Barista - Store# 12158, BELSIZE PARK - ENGLA"" at Starbucks, then look for people you might know at the company. You might be able to reach out to HR directly. Ready to apply? Check out the link in our bio.",['Retail'],[],[],0,0,,,382868816,tmj_UKR_retail,Hertfordshire Retail,125,238,0,False,440
2022-06-16 15:06:05,yes what the hell its better than Starbucks,[],[2674755604],['Rxchie_'],0,0,2674755604,Rxchie_,980552887993556993,gr8_chestnut,the bussy bully ❤️,487,1292,40554,False,16999
2022-06-16 15:05:51,I once walked in to Starbucks and ordered a Fappaccino I was quickly corrected and never ordered one again ,[],[],[],0,0,,,772297115166912512,Red_Eye_Tactics,Electric Shocktopus (Rocktopus),365,218,19606,False,15544
2022-06-16 15:05:35,It's packed always. Does Starbucks deliver?,[],[1536541567334359041],['msteph101'],0,0,1536541567334359041,msteph101,377732703,DhavalPatel71,𝘿𝙝𝙖𝙫𝙖𝙡,3758,930,4005,False,24305
2022-06-16 15:05:14,I want to buy Starbucks stock sooo bad lol,[],[],[],0,0,,,184161918,Ian_GazaBlood,Ian 👑🇯🇲🇨🇦👑,226,301,3599,False,37331
2022-06-16 15:05:06,I bought this Beyonc box set AND Starbucks. who the hell am I?! ,[],[],[],0,0,,,30746986,KaRissiNykeia,stage manager shawty.,583,1705,4340,False,154842
2022-06-16 15:04:38,Still can't use my Starbucks card at The NEC. But knew that anyway.,[],[],[],0,0,,,93726008,ellrbrown,Elliott Brown,1874,1319,47106,False,72072
2022-06-16 15:04:37,starbucks can have all my money fr,[],[],[],0,1,,,1302353782823677952,rhilynnekailey,rhi 🦂,473,543,30289,False,2754
2022-06-16 15:04:12,I'm coming to the conclusion that these so called students are nothing but a bunch of whine bums...who take out student loans to study useless subjects..then spend their money on stupid crap like 6$ coffee from Starbucks goes broke then expects everest to pay their loans fak off,[],"[1366108407325933571, 1349149096909668363]","['BidenBurner46', 'POTUS']",0,0,1366108407325933571,BidenBurner46,1474928986585137155,Tellodoroteos,Tello Doroteo,111,3,1328,False,451
2022-06-16 15:03:58,now im at a starbucks in boston life crasy,[],[],[],0,1,2275600506,onii_boy,2275600506,onii_boy,💚,694,496,52097,False,41862
2022-06-16 15:03:52,the urge to put hundreds of dollars on my starbucks card,[],[],[],0,0,,,835606448893722624,radswag,kay,211,259,22232,False,17505
2022-06-16 15:03:47,"This job might be a great fit for you. Click the link in our bio to see it and more. Shift Supervisor - Store# 12052, MUSWELL HILL - BROAD at Starbucks","['Retail', 'London']",[],[],0,0,,,348627048,tmj_CAM_retail,Cambridge Retail Job,147,206,0,False,654
2022-06-16 15:03:47,I need some coffee but Starbucks is so packed,[],[],[],0,0,,,1536541567334359041,msteph101,Steph,182,167,3085,False,244
2022-06-16 15:03:38,"The initial Buffalo victory quickly inspired unionization petitions in dozens of other cities, and Starbucks... simply couldnt maintain nearly as intense an anti-union effort... We basically shattered their anti-union campaign. , via",[],[268476335],['greenhousenyt'],1,1,,,874175612,AspenJobQuality,The Aspen Institute Economic Opportunities Program,2144,7118,10572,False,19837
2022-06-16 15:03:32,Should we get your cup ready? ,[],[1043240184643547136],['itsTEEbabyyyy'],0,0,1043240184643547136,itsTEEbabyyyy,30973,Starbucks,Starbucks Coffee,90047,11039635,22686,True,258953
2022-06-16 15:03:28,"I wouldn't exactly say there's a ""big"" effort, the only success is the Starbucks stuff in the US at a few select stores I imagine they'll quash pretty quickly in the long run. Hospitality is nigh impossible to unionise nowadays due to its structural features.",[],"[1341571258232823809, 1186648074489339904]","['AscendedView', 'FranklinVH2']",0,1,1341571258232823809,AscendedView,1379567289914306566,sdpEric,Eric Joachim Siva-Jothy,585,330,7908,False,5508
2022-06-16 15:03:22,According to my calculations you have around 10 minutes to live (1 mile) because of your milk drinking habits Jkjk milk is the based beverage,[],"[1312433556409520135, 9890492, 30973]","['theothe21684832', 'peta', 'Starbucks']",0,0,1312433556409520135,theothe21684832,1459048713905659937,Emmiccino,Emmi,30,28,173,False,3291
2022-06-16 15:03:20,"Ad hominem is bad sign. You should want to discuss things with people like me - people who might listen, and ignore some you less than pleasant insinuations. I just asked for evidence. You didn't provide. Nor did you respond to my question about Starbucks making profit.",[],"[31637750, 1190418306395787265, 1345436257506222081, 428333]","['d3sigN8t3dDruNk', 'NHDem4Ever', 'StayingPoor', 'cnnbrk']",0,0,31637750,d3sigN8t3dDruNk,4032916215,Cdnjryoung,Jamshed R the Younger,59,29,2005,False,2067
2022-06-16 15:03:15,Sounds like you've found a new favorite! ,[],[1401956352843517953],['fiorellino__1'],0,2,1401956352843517953,fiorellino__1,30973,Starbucks,Starbucks Coffee,90047,11039635,22686,True,258953
2022-06-16 15:03:13,"Ithaca DSA wants to expand its Solidarity Caucus from 2 to 3 with Tiffanys race. now is a critical time bc Ithacas the 1st city where every Starbucks unionized. corporate retaliated by closing a store, causing a citywide DSA-supported boycott. good to see national invest in it ,",[],[],[],4,11,,,1278818982175420418,AntiNateSilver,🌨 🦑 primary everyone always,4773,2650,71414,False,20319
2022-06-16 15:03:08,"Can you recommend anyone for this job in WA? Click the link in our bio to see it and more. Corporate Counsel - Global Supply Chain, Innovation, Commercial (Seattle, WA or Atlanta, GA) at Starbucks","['Legal', 'Seattle']",[],[],0,0,,,358389868,tmj_WAT_LEGAL,Tacoma Legal Jobs,247,284,0,False,457
2022-06-16 15:03:06,Was planning to go the library and then found out the Starbucks inside the library is closed so of course that has me frozen in place,[],[],[],0,0,,,1234258759570132992,sjw_twigs,hehe supremacist,82,54,10578,False,4250
2022-06-16 15:02:48,"Starbucks is hiring in ON! Click the link in our bio to apply: barista - Store# 66816, 831 DUNDAS STREET","['Woodstock', 'Retail']",[],[],0,0,,,50382485,tmj_caw_jobs,TMJ-CAW Jobs,292,445,0,False,821
2022-06-16 15:02:41,I ORDERED TO THE WRONG STARBUCKS . IM ALREADY SAT HERE DOIMG WORK AT THE OTHER STARBUCKS . this is the worse day of my life .,[],[],[],0,1,,,1282373102090035200,wonjulate,kt ♡s mia,102,369,22747,False,9862
2022-06-16 15:02:41,"I know so many farmers that drink coffee at Starbucks . We were up at 5 this morning and will work until 10-11, but we will work on the working harder thing.",[],"[1389259656636379138, 18584875]","['_soda_pressed', 'hodgetwins']",0,0,1389259656636379138,_soda_pressed,3164569250,LauraDorsey16,Laura Dorsey,293,130,4359,False,667
2022-06-16 15:02:38,"Can you recommend anyone for this job? barista - Store# 07827, BATTLEFIELD - , VA","['Leesburg', 'Retail']",[],[],0,0,,,130385473,tmj_VAW_retail,TMJ-VAW Retail Jobs,156,230,0,False,851
2022-06-16 15:02:24,"Every time I go to Starbucks I order 3 cheese danishes. You just made me grab my keys cause now I need it  ,",[],[],[],0,1,,,1199231136,camillepatrice,milli,278,267,723,False,37925
2022-06-16 15:02:20,"I got a vanilla Starbucks chilled coffee from my work's snack shack, so hopefully that'll perk me up.",[],[],[],0,2,810697689251938304,covencryptid,810697689251938304,covencryptid,✨🖤 𝙼𝚡. 𝙼𝚊𝚣 🌈🥀,844,3448,97197,False,78024
2022-06-16 15:02:08,"Visit the Starbucks caf located at the TSU or Pollak Library to beat the heat with the Caramel Ribbon Crunch and Mocha Cookie Crumble Frappuccino blended beverages. Yum!  ,",[],[],[],0,0,,,34762024,CSUFDining,Campus Dining - CSUF ASC,266,1092,532,False,1139
2022-06-16 15:02:05,Off to the doctors. I love lab workSaid no one ever. Lol. But hey its a good excuse to get some Starbucks afterwards ,[],[],[],0,4,,,2268065197,DopeSoulGirl,DopeSoul 💫,458,1067,11650,False,7964
2022-06-16 15:02:03,"""Our fight to make this state better for trans people will benefit all workers. Unionization makes workplaces safer for trans people. We deserve access to healthcare. When we fight to improve the workplace for trans people, we help all workers"" ,",[],[],[],1,2,,,488565069,TessFraad,Tess Fraad-Wolff,3760,1213,10166,False,14076
2022-06-16 15:02:03,"My suggestion: Take the money youre spending on Starbucks, Subway &amp; Dominos delivery and INVEST IT in your health &amp; fitness.",[],[],[],0,0,1275668316246376450,skolnik_david,1275668316246376450,skolnik_david,David Skolnik,104,132,128,False,551
2022-06-16 15:02:01,"I just spent 5 on this. I forgot why I do t go to Starbucks often. ,",[],[],[],0,1,,,863478131960709120,HummingJack_,✨🌈HummingJack✨,4999,1355,119666,False,37379
2022-06-16 15:02:00,"Starbucks is closing a store in Ithaca, N.Y., in what Starbucks union organizers are calling an illegal move of retaliation after workers at the location voted to unionize."" ,",[],[],[],0,0,,,108997223,ArizonaAFLCIO,Arizona AFL-CIO,1236,5607,1213,False,2836
2022-06-16 15:01:57,Drink a lot of frappes in the cool A/C Starbucks,[],"[56832765, 872355266, 20998647]","['TWCAlexWallace', 'GregPostel', 'weatherchannel']",0,1,56832765,TWCAlexWallace,2420710740,DavidRivera564,David Rivera,4772,619,2548,False,4341
2022-06-16 15:01:57,"i done got a car wash, went to starbucks &amp; to UPS in 30 min. errands done, back home to work i go lol",[],[],[],0,0,,,125554109,Jasmin_Lerai,Jassi🤎,399,549,2536,False,50623
2022-06-16 15:01:57,The Starbucks pink coconut refresher is sexyyyyt,[],[],[],0,1,,,1363237993750945792,honeyydrewdrops,ʚ 𝑖𝑙𝑑𝑎 ɞ,288,321,28417,False,10422
2022-06-16 15:01:56,"I started my work day with rainbow cake and Starbucks iced coffee. Perfect! Since Summer people have taken over my town. Time to be cool and calm, but take no .",[],[],[],0,0,,,445507184,kitsnowdrag,Kit Snow the Drag King in Training 🏳️‍🌈,2605,1177,204157,False,23106
2022-06-16 15:01:50,Let me order my Starbucks so it can. E ready when I get there,[],[],[],0,0,,,250032712,sir_pretti,Imma Celebrity‼️,771,662,1230,False,27975
2022-06-16 15:01:46,He'll have to wait on line at the Starbucks restroom + buy a latte.,[],[188061519],['RealLyndaCarter'],0,0,188061519,RealLyndaCarter,3300570411,ShadowdragonDC,Shadowdragon🐉,319,492,18409,False,14776
2022-06-16 15:01:39,"Shoutout to one of the five (5) people in office today that made a Starbucks run for us, who needs a hybrid work schedule anyway ,",[],[],[],0,6,,,42066303,AthensLuke,de🅿️ressed Dallas sports fan,2118,1277,316136,False,45341
2022-06-16 15:01:39,"Looks like I am all set to get NASDAQ at 10,000 levels soon. You know what I am doing  Just to remind, NASDAQ also has TESLA, STARBUCKS, PEPSI, COSTCO, and NOT just TECH GIANTS. ( Though TECH dominates the NASDAQ) , ,","['NASDAQ', 'buythedip']",[],[],0,0,,,1277252467,MadAboutStocks_,Ron || Mad About Stocks,694,408,3246,False,4514
2022-06-16 15:01:38,barista at Dallas love field has green braids and Im going to need you to recognize this kind of devotion to the brand,[],[30973],['Starbucks'],0,0,30973,Starbucks,1476373655726616579,TripleEmz,M,38,0,4,False,119
2022-06-16 15:01:08,"$13/month is how much our premium subscription podcast costs right now! For the price of less than 3 Starbucks coffees you could get 3-4 episodes full of coaching directed at specific board topics delivered to you weekly. Why not try it? ,",[],[],[],0,0,,,1017625155105906688,EMBoardBombs,EM Board bombs,649,8649,12448,False,6640
2022-06-16 15:01:06,Ima get Starbucks on my way back to the office rn ,[],[],[],0,1,,,3048849772,Babybrenda12,BabyBrenda,505,549,35754,False,21250
2022-06-16 15:01:05,"Yes, Starbucks is overrated but its convenient. Period.",[],[100979198],['linahrojerps'],0,0,100979198,linahrojerps,792928934413209600,rda_sulaiman,Adawiyah Sulaiman,311,351,1826,False,12158
2022-06-16 15:01:04,A bitch need to work out i always want a snack and Starbucks un un i dont like that,[],[],[],0,1,,,458538706,BigNek_,Neka,849,2874,10715,False,99295
2022-06-16 15:01:02,Starbucks coffee is gross and I refuse to buy another one unless its a smores frapp.,[],[],[],0,0,,,197830299,xlaurieannex,Laurie Anne,236,97,1627,False,5172
2022-06-16 15:00:59,Shoutout to my Starbucks for helping me! Got home and the sweet cream felt off and they offered me to come back and get something else when I could today. Totally sweet! &lt;3,[],[],[],0,0,,,1149879810115756034,KaytoeTTV,KAYTOE,47,22,6020,False,799
2022-06-16 15:00:52,"No matter how much I rise and grind, skip the Starbucks order or say no to avocado toast  it seems like there is just no catching up, writes Audrey Meubus. ,",['FirstPerson'],[],[],8,35,,,6433472,CBCNews,CBC News,1296,3340776,5902,True,264099
2022-06-16 15:00:35,why did no one tell me that starbucks refreshers have caffeine?,[],[],[],0,0,,,900125884870520832,alexxbodden15,cAUGhT a wIbE❤️‍🔥,195,257,10281,False,2593
2022-06-16 15:00:34,"My favorites are the Yukon XL's driven from school drop-off to yoga to Starbucks and then back home to the house with the ""Climate Action Now"" sign in the lawn.",[],[149913262],['iowahawkblog'],0,3,149913262,iowahawkblog,68134207,mrmiller1972,Terry Miller,2641,791,20902,False,17587
2022-06-16 15:00:22,When your man sends you money to buy Starbucks ,[],[],[],0,0,,,1483451866432294917,ITZG3NN,𝓖𝓮𝓷𝓮𝓼𝓲𝓼,124,53,3189,False,1293
2022-06-16 15:00:15,"Someone told me these petite vanilla bean scone are the bomb they are with my basic drink from Starbucks getting ready for work ,",[],[],[],0,0,,,111226101,runtyrabbit023,Runty the wizard,124,46,1117,False,380
2022-06-16 15:00:14,"Starbucks store managers have allegedly informed employees that its gender-affirming health care benefits could disappear if the employees unionize. ,",[],[],[],2,1,,,21692297,TheAdvocateMag,The Advocate,1139,303627,5639,True,74070
2022-06-16 15:00:02,"Do you have any idea of economics? If minimum wage went to $15.00 per hour? Do you have any idea what a hamburger at McDonals's would cost or a cup of Latte at Starbucks? Secondly, how do you think all of the things that Bernie wants to give a way for free would be paid for?",[],"[2997318640, 884745597605072896, 216776631]","['HLtheplug', 'mtm1516', 'BernieSanders']",0,0,2997318640,HLtheplug,1157840425,SeanGSTL,Sean Geoghegan,123,24,1,False,221
2022-06-16 14:59:51,The people at Starbucks put they foot in my shit today,[],[],[],0,0,,,66007387,A_NotNicee,A,668,1126,1295,False,126766
2022-06-16 14:59:50,"We have 49429 jobs open today at Starbucks (@StarbucksJobs), CROSSMARK (@CROSSMARKJobs), Fresh Thyme Market (@, and more.",[],"[59899837, 36039488]","['StarbucksJobs', 'CROSSMARKJobs']",0,0,,,37519805,tmj_retailjobs,TMJ Retail Jobs,123,323,0,False,946
2022-06-16 14:59:47,my coworkers are so nice lmao we all keep buying each other starbucks ,[],[],[],0,0,,,3174711649,SilverKotone,stella 💫,168,283,27726,False,123957
2022-06-16 14:59:45,I utilize DD/Starbucks for cold brew or iced drinks - we make hot coffee at home. I do have a basic cold brew steeping pitcher but dont always remember to make a batch in time.,[],[1001476869454270464],['IDPharmacometrx'],0,1,2570404072,rdr_pharmacist,2570404072,rdr_pharmacist,Rebecca 🌷,770,1104,28387,False,19147
2022-06-16 14:59:16,Literally the starbucks by my job is out until further notice like wtf you mean ?!?! Venti white choco mocha hot with almond milk and extra shot ,[],[3177217480],['Pettywap__'],0,1,3177217480,Pettywap__,2290770821,ChefJsCooking,Chef J 👨🏽‍🍳🦂,635,1068,59580,False,100613
2022-06-16 14:59:14,"I invite you to take online paid surveys at , to earn up to $5 per completed survey. Points can be redeemed as Amazon, iTunes, Starbucks gift cards or PayPal. ,",[],[],[],0,0,,,1451515710400831501,GuruSurveys,Surveys Guru,2,35,1,False,4103
2022-06-16 14:59:00,No yeah this is just my spotify faves playlist. Sorry idk how starbucks got ahold of it.,[],[74087670],['jpbrammer'],0,1,74087670,jpbrammer,1390381022840229888,TheEliRiots,💛🤍 Eli 💜🖤,145,261,13900,False,8682
2022-06-16 14:59:00,"Employees at a Starbucks on Broadway went on strike after a coworker was fired Tuesday. About a dozen people picketed Wednesday morning on the sidewalk at 37th Street and Broadway near the shop, reports. ,",[],[23487237],['benwatanabe'],0,2,,,14178003,EverettHerald,Everett Herald,1318,42013,6016,True,97992
2022-06-16 14:58:46,They're playing Running Up That Hill in this Starbucks rn,[],[],[],0,0,,,1027277103807516672,catboycatilina,liv is playing oot 🎮,1029,1154,86029,False,47421
2022-06-16 14:58:43,"Airport Starbucks cope ,",[],[],[],0,2,,,1473779661058588674,ravens_lost,Holly,183,193,7673,False,578
2022-06-16 14:58:35,"If you can dream it, you can achieve it. My go to Starbucks drink is a shaken espresso, oat milk, 3 pumps brown sugar syrup, extra ice, cold foam to top off its $11 total. My cashapp is $ianscap Thank you!",[],[1231129950931030016],['YouRLoved2022'],0,2,1231129950931030016,YouRLoved2022,812623794,IanRs25,Ian,176,266,182,False,4031
2022-06-16 14:58:24,"I was a lifeguard for 3 years. I did it because I needed money and I couldn't face working in a Starbucks, and I didn't get in the water once. ,",[],[],[],0,2,,,1309554542116298753,tiaadankfield,trevor is my qb,205,60,2272,False,897
2022-06-16 14:58:18,Bad toilet anxiety cause Ive had to get the bus (45mins) instead of the train (15mins) and just drank a full Starbucks,[],[],[],0,0,,,998152411477929985,jesstitzx,Jess ✨,197,102,5243,False,964
2022-06-16 14:58:18,The in warsaw has a pride flag that makes me so happy.,['progressinasmalltown'],[30973],['Starbucks'],0,0,,,1869116084,glencoco0614,HRH Daniel Robert,57,171,26540,False,9967
2022-06-16 14:58:04,"First time getting Starbucks  my co workers arent pleased that my basic ass got lemonade ,",[],[],[],0,2,,,1046296604,Thatoddball_,isimpforspaghetti❤️ 🙃,324,414,2678,False,15477
2022-06-16 14:58:00,"We need an episode of Vecna just living his normal life. On the phone renewing his car insurance, arguing with his neighbours over a fence, getting a Starbucks",[],[3320478908],['Stranger_Things'],0,0,3320478908,Stranger_Things,1435685212055351298,EdwardCaravan,Transfer Dave,58,24,708,False,2266
2022-06-16 14:57:49,"Stuffing my pockets full of the free napkins at Starbucks ,",[],[],[],0,3,,,1221901146303811584,volcel_genius,Brad Doctor Jekyll Hyde,1002,683,42580,False,10850
2022-06-16 14:57:36,Starbucks breakfast! I just cant fw it,[],[],[],0,0,,,1094276424536608769,moeelove1,MoMo💋,948,709,7144,False,1386
2022-06-16 14:57:17,"disgusted that my sister has contacted you today asking for support upon arrival tomorrow for her 12 week old baby who has just had surgery and is in casts, to be told her only option to breastfeed him is to sit in Starbucks until check-in  really? In 2022?",[],[19340869],['CenterParcsUK'],0,1,19340869,CenterParcsUK,2304289983,FarrellCurt,Caitlin Farrell 🍓,2150,778,6318,False,8286
2022-06-16 14:57:17,not a car just breaking down in the Starbucks drive thru ,[],[],[],0,1,,,295491348,_miabonita,𝑀𝒾𝒶 ❤️‍🔥,240,853,90308,False,5492
2022-06-16 14:57:16,i went to reload $10 on my starbucks card and it defaulted back to $25? in this economy?,[],[],[],0,1,,,595500831,sydneylucillee,Sydney,858,422,23657,False,12027
2022-06-16 14:57:07,"Well, not so frightening with Starbucks in hand lol",[],[1408140113431904262],['whitneysvision'],0,0,1408140113431904262,whitneysvision,1216208975349407744,DonFromDaBx,DonP,60,5,196,False,109
2022-06-16 14:57:04,"Exactly. I just get really frustrated when folks think picking up and moving or not getting Starbucks is the issue here. People deserve to live happily, the stress of penny pinching everything is also not sustainable",[],[95253556],['Unkle_Nesto'],0,1,95253556,Unkle_Nesto,562581691,thedeej_11,Deja 🇵🇦,168,168,4028,False,31319
2022-06-16 14:56:57,i think its fine! at least where i live the starbucks workers dont really care too much,[],[1349600596483928065],['M4RCSPECT0R'],0,0,1349600596483928065,M4RCSPECT0R,1459353260670664704,skatertimdrake,phoebe | TIM DRAKE SOLO,109,105,1711,False,380
2022-06-16 14:56:57,i still cant believe starbucks got rid of my fave coffee i will never forgive them,[],[],[],0,0,,,1383292922150350849,taffyv0mit,nia🌧,86,132,10892,False,2141
2022-06-16 14:56:54,Buddy do not be fucking with shit that I really be wanting to eat he makes me pay for it everytime Im starting to think all he want is Starbucks ,[],[],[],0,0,,,280517795,pr3cious_stone,Shaniqua M 💚,959,1076,1458,False,27549
2022-06-16 14:56:47,"Want to work in England? View our latest opening: ,",['Retail'],[],[],0,0,,,38066727,tmj_ukm_jobs,TMJ-UKM Jobs,307,435,0,False,283
2022-06-16 14:56:37,"Starbucks is hiring in MB! Read about our latest job opening via the link in our bio: barista - Store# 04896, CHARLESWOOD","['Winnipeg', 'Retail']",[],[],0,0,,,155941603,tmj_MB_retail,TMJ-MB Retail Jobs,95,186,0,False,696
2022-06-16 14:56:32,starbucks not having green straws is really ruining my vibe,[],[],[],0,0,,,43587883,stirfried_WEISS,ray,250,104,1935,False,3518
2022-06-16 14:56:13,Dunkin right outside my hotel and walked an extra three blocks for Starbucks,[],[302812134],['ashvinmelwani'],0,0,1168242166726086656,tclarkmedia,1168242166726086656,tclarkmedia,Tommy Clark 🐳,869,3148,21507,False,14187
2022-06-16 14:56:08,"Maybe in Starbucks bathrooms? (While it lasts, because Starbucks CEO plans to shut bathrooms to non-clients)",[],[188061519],['RealLyndaCarter'],0,0,188061519,RealLyndaCarter,14836297,betocreativo,Betualdo,2300,1582,3377,False,219090
2022-06-16 14:56:07,im really spending $20 to have starbucks delivered to my house ,[],[],[],0,0,,,219484338,arvpz0,a.,537,1212,8914,False,111880
2022-06-16 14:55:57,"I stopped buying Starbucks for the past two months, 1. To save myself some money, 2. To cut caffeine off, yet I hadnt realized that I practically have been taking pre for the past two months too",[],[],[],0,2,,,3303496717,Jnyez10,jny 𓁹,351,402,37812,False,15204
2022-06-16 14:55:54,Got myself a little treat (Starbucks) for my morning bc I deserve it. Also bc I'm so sleepy this morning I kept dropping my combos on music bc I was yawning so much,[],[],[],0,0,,,4144243708,imaginenerds,I'm Dying Squirtle,121,64,4805,False,7870
2022-06-16 14:55:41,Boycott target theyll come around like Starbucks trust me,[],"[1431039349940948998, 63265877]","['egreco777', 'starliteinvoker']",0,1,1431039349940948998,egreco777,1529842617202135040,Wiliamsmind7,William Campbell,523,245,631,False,171
