created_at,text,hashtags,user_mention_ids,user_mention_screen_names,retweet_count,favorite_count,in_reply_to_user_id,in_reply_to_screen_name,user_id,user_screen_name,user_name,user_friends_count,user_followers_count,user_favourites_count,user_verfied,user_statuses_count
2022-06-16 12:55:06,"Meet Mellody Hobson, the Starbucks chair  and wife of George Lucas  who's about to become the first Black woman part-owner in the NFL ,",[],[],[],0,0,,,2898918799,ManLeeHood,Manny Hood,197,199,115,False,89318
2022-06-16 12:54:58,"i think our countries are conservative and a bit behind but thats beginning to change, personally i loathe dress codes other than for red carpet events and weddings but again ive never had a non-remote office job",[],[1007960301067792384],['starbucks_of'],0,1,1007960301067792384,starbucks_of,1296945232039350272,FindLoraM,Lora M.,655,338,30391,False,20022
2022-06-16 12:54:47,I'm glad I stopped at Starbucks before work. I should have put liquor in my refresher instead of lemonade.,[],[],[],0,1,,,1184206801128099840,_Iam_PapiChulo,Papi Chulo,544,603,10278,False,7504
2022-06-16 12:54:17,We did it! Currently in line for starbucks~,[],[],[],0,1,,,854925350,Lureii,‍Lore☁💜🐳,1754,1227,9852,False,33940
2022-06-16 12:54:16,9s first words this morning Good morning Words 3-5 we're can yiy take me to Starbucks.,[],[],[],0,1,,,1099763481664987137,DerbeckerP,V.P_Derbecker,1484,567,11384,False,8355
2022-06-16 12:54:16,LPT Social If you forget a girl's name.. take her to Starbucks.,['ifb'],[],[],0,0,,,1442647707429089281,RealLifeProTips,Life Pro Tips,0,31,0,False,1219
2022-06-16 12:54:12,My Store Manager from Upstate NY came to this store while this situation is unfolding. Don't believe what Starbucks is saying about it not being profitable. Managers state-wide were in on this situation.,[],[1470944601309528072],['JortsTheCat'],0,0,1470944601309528072,JortsTheCat,1216898738784030720,oktaviaokay,🖤 𝑨𝒗𝒊 🖤,153,11,4178,False,206
2022-06-16 12:54:12,Chase Asked For Starbucks Yesterday &amp; I Cant Wait Til He Wake Up So We Can Go On A Date,[],[],[],0,0,,,1329064076811657216,keesshdamanz,keesh,117,161,323,False,1136
2022-06-16 12:54:07,On time for work &amp; I got my Starbucks todays gonna be a good day ,[],[],[],0,0,,,565785272,Mocaaa__a,MOCAHONTAS🍯,965,1130,3540,False,25924
2022-06-16 12:53:52,starbucks know they be robbing ppl,[],[],[],0,0,,,1462428833563435008,bcox711,🦋,39,43,1920,False,455
2022-06-16 12:53:42,"I don't know which one of my followers suggested added Sriracha on my burrito from starbucks. But you know what tf you are talking about and I thank you for that!!!! ,",[],[],[],0,1,,,1184206801128099840,_Iam_PapiChulo,Papi Chulo,544,603,10278,False,7504
2022-06-16 12:53:38,"My father, who is a 3-4 cup a day guy, is enamored of the Starbucks instant coffee that comes in little tubes. He even makes it sometimes when more traditional coffee-making methods are available, like at my house. I think thats weird but also its a pretty strong endorsement.",[],"[14525172, 15638615]","['byJenAMiller', 'lindaholmes']",0,0,14525172,byJenAMiller,18105922,vcmcguire,Claire McGuire 🏳️‍🌈,1139,2405,52491,False,54187
2022-06-16 12:53:37,i wanted that starbucks real bad so im finna be mad until i get it,[],[],[],0,0,,,785692308,__ctd,just happy 2 be here,1764,2246,170597,False,30927
2022-06-16 12:53:32,"Meet the Starbucks chair  and wife of George Lucas  whos about to become the first Black woman part-owner in the , (via@BusinessInsider)","['NFL', 'news', 'breaking', 'sports', 'business']",[32439603],['MellodyHobson'],0,0,,,454478622,Newzjunkie_,HEADLINE NEWS,515,539,213,False,122958
2022-06-16 12:53:09,"Young girl outside starbucks bawling her eyes out in a wheelchair,city centre just now begging,not a junky.Watched for 10 minutes not 1 person asked is she ok,standing next to her with coffees.I'm no saint.. I did, people were abusing her. Nobody cares anymore. Country is lost",[],[],[],0,1,,,1373712659946815492,Bleakhouse12,BH 🇮🇪 🌍🌎🌏⏳((( 🇷🇺🤝🇺🇦))),373,295,2904,False,2615
2022-06-16 12:53:05,i feel like need to see me at the moment but idk,[],[30973],['Starbucks'],1,0,,,959201861323673602,1deuceyb,double 🅿️,1067,1208,136,False,106123
2022-06-16 12:53:02,Yo why the people in the Starbucks really know my dad this crazy.,[],[],[],0,0,,,2985183857,deexboogs,Big Boogs,167,231,3460,False,1782
2022-06-16 12:52:59,"Starbucks, Restaurants, vacations",[],[1224856141160685571],['PSworldwide13'],0,0,1224856141160685571,PSworldwide13,876547812,tomatden,Tom Peters,425,46,869,False,574
2022-06-16 12:52:50,I couldve went to get my Starbucks but these people said 8:45 when it really starts at 9 ,[],[],[],0,0,,,438703925,SashaunaAmoy,Dr.Phil,333,225,13773,False,16626
2022-06-16 12:52:30,Which reminds melemme stop buying Starbucks. ,[],[59521437],['ShellBell429'],0,0,59521437,ShellBell429,18392987,alovelydai,6twenty9 ♋️ 🦀,410,1126,16509,False,165827
2022-06-16 12:52:20,All this AND I travel with emergency Starbucks via packets just in case all those options fail,[],[15638615],['lindaholmes'],0,0,15638615,lindaholmes,63887389,TammyEnright,Tammy Enright 🌸 🚣🏼‍♀️ 🏳️‍🌈,268,193,1353,False,1558
2022-06-16 12:52:14,Starbucks this morning cause Im so tired,[],[],[],0,0,,,300232793,_ItsLeighsa,🌻,499,866,3423,False,45884
2022-06-16 12:52:07,Made It To Starbucks Before My Hair Apt.,[],[],[],0,0,,,501300899,HisLilBADDBitch,𝗡𝗮𝘂𝘁𝗶𝐶𝗮.,351,28649,23822,False,97844
2022-06-16 12:52:04,Idc I love starbucks refreshers.,[],[],[],0,0,,,948238802954477568,NlCKIBANKS,N,760,1179,22605,False,32237
2022-06-16 12:52:01,Depends on the tone if it's a calm green with calm base ehh I thinks it's not problemtic lol,[],[1260668856407916546],['TheresaSofie_'],0,1,1260668856407916546,TheresaSofie_,1007960301067792384,starbucks_of,Queen Of Scepticism,490,504,37911,False,22510
2022-06-16 12:51:51,Your doctor has shorted Starbucks and Dutch Bros,[],[41225235],['sgmpodcst'],0,1,41225235,sgmpodcst,1284540517435482113,HarleyMCarroll,Harley Carroll,213,3930,8819,False,5287
2022-06-16 12:51:34,Just learned Starbucks employees have unionized over 150+ stores in less than 6 months. Cant wait for the National Guard to start shelling our coffee shops.,[],[],[],0,2,,,1466201370,G_melia96,Professional Cynic,258,336,41991,False,22680
2022-06-16 12:51:13,"Yes I know, I meant a ""formal"" green shirt ",[],[1007960301067792384],['starbucks_of'],0,1,1007960301067792384,starbucks_of,1260668856407916546,TheresaSofie_,Theresa,609,865,31421,False,1171
2022-06-16 12:51:04,"Seeing a ""let's go Brandon"" sticker at a Starbucks drive thru is hilarious to me idk why lol",[],[],[],0,0,,,554894534,_LucidDreams,Akiliano,435,468,29920,False,116088
2022-06-16 12:50:59,Dunkins Refresher Does Not Taste Better Than Starbucks . Yall Lied ,[],[],[],0,0,,,244769947,DarkAndLovely_K,(K)ierra (D),642,974,1792,False,33086
2022-06-16 12:50:53,"We all have crypto, we all have crypto wallet apps, we just need a few big companies to start accepting payments ie McDonalds, Apple, Amazon, Starbucks etc and then everything else will follow, global acceptance",[],[1532065934349049856],['XiaosuZhang'],0,0,1532065934349049856,XiaosuZhang,1036775437,markyKG,Marky KG,90,55,1111,False,1811
2022-06-16 12:50:23,Its always Starbucks too,[],[1510748325053870084],['koi_takleef_'],0,0,1510748325053870084,koi_takleef_,1294684368158502912,chloetoni_,Chloe | Lifestyle Blogger,322,528,449,False,327
2022-06-16 12:50:22,"Meet Mellody Hobson, the Starbucks chair &amp;mdash; and wife of George Lucas &amp;mdash; who's about to become the first Black woman part-owner in the NFL , Earn money now. Work on the Internet! , (#Siguemeytesigo) (#Followback) (#News) (#SDV)","['Siguemeytesigo', 'Followback', 'News', 'SDV']",[],[],0,0,,,1382677869554458626,smorffer,smorffer,11547,10596,0,False,121425
2022-06-16 12:50:14,I am not saying u shouldn't wear formal I literally said wearing formal but colorful Ofc u won't wear a shirt or a jeans lol,[],[1260668856407916546],['TheresaSofie_'],0,1,1260668856407916546,TheresaSofie_,1007960301067792384,starbucks_of,Queen Of Scepticism,490,504,37911,False,22510
2022-06-16 12:50:13,"Theres a separate contest for people mishearing &amp; calling me another name entirely  Like the Starbucks barista who called me Lucy. Another one who called me Linda. Or the vicar at my Nans funeral years ago, who called me Lydia.",[],[],[],0,0,40231884,Lins_Rumbold,40231884,Lins_Rumbold,Lindsay Rumbold,2087,2121,27251,False,29926
2022-06-16 12:49:59,"made my own version of the starbucks iced peach green tea and it tastes disgusting ,",[],[],[],0,2,,,1265758396336287747,citygirlnaz,naz,82,68,9213,False,7322
2022-06-16 12:49:38,i like how determined i am i am at my 3rd starbucks trynna get this drink,[],[],[],0,0,,,884703985130721280,donidayoungin,Adoni C💗.,1605,1868,83413,False,65377
2022-06-16 12:49:28,"We're hiring! Click to apply: Shift Supervisor - Store# 19582, MILTON KEYNES, THE PLACE RETAI - ,",['Retail'],[],[],0,0,,,348627048,tmj_CAM_retail,Cambridge Retail Job,147,206,0,False,654
2022-06-16 12:49:23,"Meet Mellody Hobson, the Starbucks chair  and wife of George Lucas  who's about to become the first Black woman part-owner in the NFL ,",[],[],[],0,0,,,1668194960,Zicutake,Zicutake,1,2023,21579,False,419936
2022-06-16 12:49:23,"I want a spinach, feta &amp; egg white wrap and caramel Frappuccino from Starbucks ",[],[],[],0,0,,,259541992,twink_ah_link,Twink,610,748,15814,False,73417
2022-06-16 12:49:06,"Meet Mellody Hobson, the Starbucks chair  and wife of George Lucas  who's about to become the first Black woman part-owner in the NFL , ,",[],[],[],0,0,,,293968006,SPORTSCIRCUSINT,SPORTS CIRCUS INT.,2351,1399,246,False,323714
2022-06-16 12:49:01,Awh the Starbucks near my job is so sweet. I accidentally sent my order to the wrong place and they were kind enough to make it for me ,[],[],[],0,0,,,305248738,KeepingIttReall,alexandraamylonas,135,825,32886,False,81406
2022-06-16 12:48:51,"It depends on the job, on how conservative the environment there is, and on the individual interviewer but I also don't understand why you shouldn't be able to make a good impression in a green shirt.",[],[1007960301067792384],['starbucks_of'],0,1,1007960301067792384,starbucks_of,1260668856407916546,TheresaSofie_,Theresa,609,865,31421,False,1171
2022-06-16 12:48:48,Oof. Starbucks pricing is hitting hard right now. I hadnt gone in awhile and was a bit surprised a grande cold brew is over $5 now and a grande latte $6.,[],[],[],0,0,,,55077072,AshDee04,🦩 Marie 🦩,1051,395,33296,False,15238
2022-06-16 12:48:37,"Me in Starbucks: ,",[],[],[],0,0,,,1419912057147871238,SailorSolaria,Sᗢ 🍂,84,390,2359,False,1478
2022-06-16 12:48:12,This Starbucks is about to hit,[],[],[],0,0,,,232239121,anxj88,robz🧖🏼‍♀️,240,609,57125,False,25712
2022-06-16 12:48:01,Whenever I get Starbucks I realize how good and overpriced it is.,[],[],[],0,0,,,994721097101795329,1016AVE,A.,24,143,666,False,55558
2022-06-16 12:47:59," Starbucks Tagaytay City ,",[],[],[],0,0,,,1529749504412397568,jezerosix,JB,15,3,169,False,43
2022-06-16 12:47:55,(In a world without animals) Me: LOL! So nice to see you! TV: Did you say something? Me: That's disgusting! Starbucks Employee: Best day ever! *too insecure to say no*,['joke'],[],[],0,0,,,954523728607698944,rtrjokes,Al Botcino,22,54,37,False,27160
2022-06-16 12:47:51,"Shout out to for consistently not filling the coffees all the way. Its getting ridiculous here in NJ! This is my coffee untouched, no sips taken yet. ,",[],[30973],['Starbucks'],0,0,,,1482381429862506497,JaclynS79587223,Jaclyn Smith,1,0,0,False,5
2022-06-16 12:47:49,"It is a 20 min wait for pre-ordered drinks in the PATH. This has to be a sign that there is a return to office. And that we need to open more Starbucks - or fix the app ,",[],[30973],['Starbucks'],0,7,,,914955336016187392,veronicalgreen,veronicalgreen,671,798,2368,False,930
2022-06-16 12:47:46,"Now hiring for 596 job opportunities at Hobby Lobby Stores (@HobbyLobbyJobs), Bassett Furniture (@BassettCareerUS), Starbucks (@StarbucksJobs), and more.",[],"[3003553487, 743440638348189699, 59899837]","['HobbyLobbyJobs', 'BassettCareerUS', 'StarbucksJobs']",0,0,,,130385473,tmj_VAW_retail,TMJ-VAW Retail Jobs,156,230,0,False,851
2022-06-16 12:47:46,"Toronto is back in business! . People going to work, patios filled,  shops filled! Must have been 40 people waiting for a Starbucks at Union  early this morning. ,","['Toronto', 'Ontario']",[],[],0,0,,,2176914558,TraceySGrote,Tray Tray ❤️,346,169,2526,False,887
2022-06-16 12:47:43,Starbucks for breakfast I think so.,[],[],[],0,0,,,251680771,GVOBabyy,🎨✨,675,1847,11012,False,82418
2022-06-16 12:47:43,every low cal starbucks thread mildly annoys b/c instead of doing all these gymnastics for a shitty drink like the threads say u could just like. order a tea?,[],[],[],0,0,,,1413947630468599810,huasound,jude,67,57,47,False,244
2022-06-16 12:47:36,"Starbucks is reportedly threatening trans healthcare benefits to prevent union organizing ,","['tech', 'feedly']",[],[],0,0,,,15675168,DarthGrimace,Allen Cook,572,1010,30034,False,98514
2022-06-16 12:47:28,Nothing worse than a part time Starbucks worker that has a photography business,[],[],[],0,0,,,1296618575101341698,ManningMillz,Manning Miller,139,56,201,False,1927
2022-06-16 12:47:24,dunkin donuts has absolutely nothing on starbucks and i dont want there to ever be any confusion,[],[],[],0,0,,,367210484,sasham_w,🥀,286,407,1112,False,27073
2022-06-16 12:47:20,Someone send or bring Starbucks..... I will not make it today without caffeine,[],[],[],0,0,,,2734669029,bbgirlMel,la melasa✨,363,619,83763,False,50638
2022-06-16 12:47:09,"Meet Mellody Hobson, the Starbucks chair  and wife of George Lucas  who's about to become the first Black woman part-owner in the NFL , via",[],[20562637],['BusinessInsider'],0,0,,,309238549,_DrFrusci,Dr. Joseph Frusci,3802,3059,22379,False,209042
2022-06-16 12:46:57,Like i don't like wearing basic colors with suits so boring Literally all my blazes r colorful now I have black and Grey one but I don't want to wear them.,[],[2271981330],['ElMaloquino'],0,2,2271981330,ElMaloquino,1007960301067792384,starbucks_of,Queen Of Scepticism,490,504,37911,False,22510
2022-06-16 12:46:48,"Meet Mellody Hobson, the Starbucks chair  and wife of George Lucas  who's about to become the first Black woman part-owner in the NFL ,",[],[],[],23,34,,,20562637,BusinessInsider,Business Insider,413,3747039,2148,True,711680
2022-06-16 12:46:21,"I'm the opposite of a Starbucks fan, but that bathroom scam was an obvious set-up. The 2 black ""entrepreneurs"" got a big payday. That was their ""business plan"" and it worked perfectly. Kevin Johnson quickly caved in. White guilt paid off in a big way for race hustlers yet again.",[],"[900113336, 312921460]","['JVER2ME', 'tdpga']",1,0,900113336,JVER2ME,4861104565,Guy_Knob,Guy_Knob,4732,2661,105994,False,19162
2022-06-16 12:46:21,"Small  Tall Starbucks smallest marketed size makes zero sense. How is a tall the smallest size? Its a psychological trick. The small still exists, but its not on the menu. The move made Grande the most-ordered size. More Starbs tricks via ,",[],[945817135816654848],['TrungTPhan'],6,49,614480464,nathanbaugh27,614480464,nathanbaugh27,Nathan Baugh,863,120865,36738,False,3277
2022-06-16 12:46:14,"If learned from on the efficiency at the drive up windows theyd be elite! More lanes and people outside taking orders, etc.",[],"[30973, 16043308]","['Starbucks', 'ChickfilA']",0,0,,,242876639,CodyHester3,Cody Hester,278,378,2142,False,9784
2022-06-16 12:45:45,"Activists been murdered on behest of corporations &amp; politicians 4 long time but you must have MacDonalds Starbucks &amp; drive an SUV Dom Phillips and Bruno Pereira: Brazil police find two bodies in search for missing men ,","['ClimateCrisis', 'Activism', 'environment']",[],[],0,0,,,1270383778498777090,MirBahmanyar,Mir Bahmanyar real person- facts only,669,744,32353,False,12938
2022-06-16 12:45:27,Legally blond moment,[],[1007960301067792384],['starbucks_of'],0,2,1007960301067792384,starbucks_of,2271981330,ElMaloquino,Ilias | ⵉⵍⵢⴰⵙ,1161,257,19230,False,7662
2022-06-16 12:45:15,One thing bout Starbucks its guna give u the bubble guts ,[],[],[],0,1,,,2189495943,nesh______,NESH🖕🏽,706,942,19297,False,14992
2022-06-16 12:45:01,If yall feeling generous and wanna buy my Starbucks $MorraPerriadora ,[],[],[],0,1,,,700558609411780608,MorraPerriadora,• Simp •,1909,13619,38165,False,78964
2022-06-16 12:44:50,"Dutch Bros Is Finally Coming To KC, Move Over Starbucks",[],[],[],0,0,,,1486054344793505793,JovanniMay,Jovanni,116,31,50,False,2357
2022-06-16 12:44:46,Based Like imagine u wearing a colorful suit and they be like oh not wearing black or dark blue Canceled!,[],[2271981330],['ElMaloquino'],0,2,2271981330,ElMaloquino,1007960301067792384,starbucks_of,Queen Of Scepticism,490,504,37911,False,22510
2022-06-16 12:44:42,i be in starbucks too damn much bc no way this barista knows my name AND knows how to actually spell that shit ,[],[],[],0,0,,,170558229,cognacqueeenn,🥰,297,431,18293,False,95888
2022-06-16 12:44:39,Mad white ppl in Starbucks. Only one black dude,[],[],[],0,0,,,1512043900529225734,Carl26460442,Carl,121,16,207,False,6350
2022-06-16 12:44:25,Nothing annoys me more when Starbucks says Let me see if we have any  I be wanting to pull off so bad!,[],[],[],0,0,,,321783153,_Camisha_,Camisha✨,330,537,721,False,18370
2022-06-16 12:44:23,I usually travel with the Starbucks via packets in a dark roast. Find hot water and chug the first dose of caffeine to become human enough to find decent options for the second dose.,[],"[30656264, 15638615]","['EllieMargolis', 'lindaholmes']",0,0,30656264,EllieMargolis,4080344310,JenLovesHistory,jennifer,1511,471,67236,False,14017
2022-06-16 12:44:22," 'Onward' by Howard Schultz Starbucks isn't just another brand. It changed the fabric of American life. This book shares how Schultz maintained Starbucks' identity through explosive growth. ,",[],[7097602],['ArlanWasHere'],0,1,228834325,BenjaminPutano,228834325,BenjaminPutano,Ben Putano 📚,1109,3345,33523,False,16242
2022-06-16 12:43:33,"i drove all the way to starbucks and they dont have matcha , goodbye",[],[],[],0,1,,,747910518124380160,aydxnais,the don,1096,1378,35988,False,27531
2022-06-16 12:43:14,I wore khaki and got the job lmao,[],[1007960301067792384],['starbucks_of'],0,4,1007960301067792384,starbucks_of,2271981330,ElMaloquino,Ilias | ⵉⵍⵢⴰⵙ,1161,257,19230,False,7662
2022-06-16 12:43:05,Got a frappe from the new Starbucks on Albany road while putting together my pirate costume and the staff were very sweet to me. Ive been getting mad looks from people today. Must be the weather.,[],[],[],0,7,,,234117878,ShartiTheClown,Franklin,664,2686,127027,False,65464
2022-06-16 12:43:05,"thank you im getting starbucks to survive rn ,",[],[1449958252473552900],['pastaonflights'],0,0,1449958252473552900,pastaonflights,1299370420228050944,zmaxiie,max🕊,582,6069,3911,False,14056
2022-06-16 12:42:51,What's this,[],[826848012139954177],['alzandaqa'],0,2,826848012139954177,alzandaqa,1007960301067792384,starbucks_of,Queen Of Scepticism,490,504,37911,False,22510
2022-06-16 12:42:48,Her: Do you want Starbucks? Me: Sure. Coffee is great! Her: Regular coffee? It's hot outside. Me: Ok. Iced coffee it is. Her: Ok.. creamer? Sweetener? Me: Make a judgement call... She'll probably never talk to me again,[],[],[],0,0,,,15964250,VivaLaSeth,Seth,657,376,400,False,7058
2022-06-16 12:42:31,People be like u gotta wear black or dark blue for ur interview That's so boring imma wear a colorful blazer lol Does it really matter as long as u r wearing formal and looking presentable!!?,[],[],[],0,16,,,1007960301067792384,starbucks_of,Queen Of Scepticism,490,504,37911,False,22510
2022-06-16 12:42:28,Starbucks PI?,[],[71738347],['djk0vk'],0,0,71738347,djk0vk,1230441777569525760,kopimanualbrew,V60,233,522,3675,False,2111
2022-06-16 12:42:24,already decided im getting starbucks before work later because today is a day,[],[],[],0,0,,,929085391130578944,whosthatbrownnn,MelB,250,138,6565,False,4507
2022-06-16 12:42:20,Youre right about having every right to your opinions just like the rest of us. But just like the rest of us your opinion and $10 might get you something to drink at Starbucks.,[],[248917209],['hwinkler4real'],0,1,248917209,hwinkler4real,1194407628,grocnroll,Glenn O'Connor,71,34,6,False,33
2022-06-16 12:42:12,"New cup is a dgd reference  is this confirmation starbucks fucks with  ,",[],[39360904],['DGDtheband'],0,1,,,760857181398798336,kaaitelise,kaitsadilla,227,197,80561,False,43935
2022-06-16 12:42:03,"The Branding Secret Lyft, Southwest and Starbucks Use That Your Business Should Too , - ,","['business', 'branding']",[19407053],['Entrepreneur'],0,2,,,76966092,johnrampton,John Rampton,578577,1263455,19336,True,37651
2022-06-16 12:41:52,how come all my Starbucks are out of Oatmilk and have been out for WEEKS. IN PRIDE MONTH!?,[],[30973],['Starbucks'],0,0,30973,Starbucks,76525316,GameGoddessAlx,Allie || CLOSED For Logos & Branding Work,261,1549,3389,False,2015
2022-06-16 12:41:49,Starbucks said they broke too. ,[],[2333080109],['mminthecity'],0,0,2333080109,mminthecity,18392987,alovelydai,6twenty9 ♋️ 🦀,410,1126,16509,False,165827
2022-06-16 12:41:27,"Vecna talking on the phone this is hilarious and drinking Starbucks lololol ,",[],[],[],0,0,,,454328241,roselIiott,🌻,1175,1034,25956,False,123973
2022-06-16 12:41:25,"Interested in a job in Scotland? This could be a great fit. Click the link in our bio to apply: Barista - Store# 15291, EDINBURGH - THE CUBE at Starbucks",['Retail'],[],[],0,0,,,38067675,tmj_uke_jobs,TMJ-UKE Jobs,317,388,0,False,395
2022-06-16 12:41:24,like why were there at least 4 frappe orders this morning at the starbucks by my job ,[],[],[],0,1,1355209183461662727,apologygirII,1355209183461662727,apologygirII,🐇,851,379,52017,False,38509
2022-06-16 12:41:01,But yea we cant afford a house cuz of our avocado toast &amp; our Starbucks,[],[],[],2,1,1477302557391429634,_emiramari,1477302557391429634,_emiramari,🍕🫒,595,519,12405,False,19168
2022-06-16 12:41:01,The Starbucks box of it and it's just for Care Bear?,[],[1221805425307287558],['liltx_cbink'],0,1,1221805425307287558,liltx_cbink,1248072745063256064,randomdudepdx,Jeremy No Longer in PDX,1506,911,142715,False,40854
2022-06-16 12:40:52,I was already 15 minutes late to work and now Im in the drive thru for Starbucks lmao,[],[],[],0,0,,,3271750945,ororo__munroe94,Sheila,223,229,18865,False,24767
2022-06-16 12:40:52,the grilled cheese from starbucks is actually bomb af,[],[],[],0,2,,,1257157074447990784,xojohaness,jo 🐉,164,194,3499,False,1016
2022-06-16 12:40:50,Skipping my $7 Starbucks so I can buy a home in *checks notes* 153 years,[],[],[],23,125,,,1432518511939760132,socialistsloots,Lia,1129,640,10892,False,1435
2022-06-16 12:40:45,Ive been trying to settle for Folgers lately but the Starbucks demons won today,[],[52214561],['CheeyeahBoy'],0,0,52214561,CheeyeahBoy,131660423,sam_XOTWOD,sam 🌬,312,1037,146247,False,74634
2022-06-16 12:40:25,"The meeting ended and it was only 7:36am so I got Starbucks!!  ,",[],[937912509935312896],['lionesswrites'],0,0,937912509935312896,lionesswrites,876142417665241089,borzzoi,rachel✨🏹🎨🏔,185,572,57590,False,29054
2022-06-16 12:40:12,"Then you agree with the vegan ""milk"" costing more. Good",[],"[1534618766859976708, 1455884504460144640, 9890492, 30973]","['OJdubz19', 'DeCellae', 'peta', 'Starbucks']",0,1,1534618766859976708,OJdubz19,1898599375,mischievousclay,Clay,25,10,1109,False,832
2022-06-16 12:40:09,Welcome to Starbucks!,[],[2236811695],['sentipensar'],0,1,2236811695,sentipensar,151281950,PerezaDiurna,ЯΛFΛ,1144,360,11680,False,34233
2022-06-16 12:39:42,Finna go to Starbucks,[],[],[],0,0,,,45721747,Pink_Vulture,Tamice 💃🏽,1025,1083,2220,False,56581
2022-06-16 12:39:32,"I'm at Starbucks RD in Santo Domingo, Distrito Nacional ,",[],[],[],0,0,,,154272351,Gabriela2827,Gabriela Salazar,532,338,9473,False,12018
2022-06-16 12:39:29,Left a 300 pair of headphones in Starbucks yesterday. Went back and someone had handed them in. Only in Dubai! ,[],[],[],0,0,,,1384084082875715587,Attashhh,aa86,753,44,258,False,374
2022-06-16 12:39:08,My understanding is that it's not uncommon for trans people to go work at Starbucks specifically for the healthcare benefits ,[],[18885522],['thomdunn'],0,1,18885522,thomdunn,28037211,RachelCraves,Rachel H,2918,1212,89108,False,80983
2022-06-16 12:39:06,Oh he's only round the corner from Starbucks ,[],"[456976916, 369465018]","['MalLunam', 'BuswayLee']",0,2,456976916,MalLunam,1108057066013376518,cb_buses,Charlezzz,353,419,7861,False,3421
2022-06-16 12:38:50,it's worse w/international travel when you take too long to get ready and miss your get beloved american drip coffee at starbucks window and realize you're without caffeine for the day,[],[15638615],['lindaholmes'],0,1,15638615,lindaholmes,169155362,hc1059,Heather Carpenter,653,108,92,False,23535
2022-06-16 12:38:21,Holy shit I just made my own fucking iced coffee and it tastes 100 times better than the shit Starbucks would sell for 5,[],[],[],0,3,,,1057124207061098499,Weebwulf_,Lewis,698,102,28060,False,2115
2022-06-16 12:38:18,Shuddered looking at my order history on my Starbucks app this morning. Not sure those double espressos are a good idea for me  I feel good today tho. Have a great day!,[],[],[],0,1,,,39611080,christina___b,Christina B,385,151,9023,False,9626
2022-06-16 12:38:08,my daughter think she can get Starbucks daily and I don't like that,[],[],[],0,0,,,115225261,Sue_BSlickTalkN,🌪Pulchritudinous,537,598,1664,False,48233
